id,object_type,slug,seo_title,seo_description,is_pillar_content,focus_keyword,seo_score,robots,advanced_robots,canonical_url,primary_term,schema_data,social_facebook_thumbnail,social_facebook_title,social_facebook_description,social_twitter_thumbnail,social_twitter_title,social_twitter_description,redirect_to,redirect_type
"3","post","privacy-policy","","","no","","11","index","","","","","","","","","","","",""
"1234","post","ki-agenten-blog","KI Agenten Blog – Entdecke die besten KI-Agenten, Tools &amp; Automatisierungstrends 2025","Willkommen beim KI Agenten Blog! Erfahre alles über innovative KI-Agenten, Automatisierung und smarte Business-Strategien. Entdecke Tools, Trends &amp; Praxisbeispiele für 2025.","no","KI Agenten Blog,AI Agents Blog,Künstliche Intelligenz Agenten","83","index","","","","","","KI Agenten Blog – Entdecke die besten KI-Agenten, Tools &amp; Automatisierungstrends 2025","Willkommen beim KI Agenten Blog! Erfahre alles über innovative KI-Agenten, Automatisierung und smarte Business-Strategien. Entdecke Tools, Trends &amp; Praxisbeispiele für 2025.","","","","",""
"1502","post","support","","","no","","","","","","","","","","","","","","",""
"1571","post","sicheres-ki-projektmanagement-preise","sicheres KI-Projektmanagement Preise | Varna Agenten SaaS","Vergleichen Sie sicheres KI-Projektmanagement Preise bei Varna Agenten. DSGVO-konform, transparent und ideal für KMU in Deutschland. Jetzt starten.","no","KI-Projektmanagement Preise,AI Projektmanagement Kosten,DSGVO-konforme SaaS Preise,KMU Automatisierung Kosten","64","index","","","","","","","","","","","",""
"1658","post","ai-marketing-trends-2025-bulgarian-businesses","Unlocking Guaranteed Success: AI Marketing Trends 2025 Bulgarian businesses","Discover the €2.3M ROI revolution and explore the AI marketing trends 2025 Bulgarian businesses need to succeed and thrive in the digital age.","no","AI marketing trends 2025 Bulgarian businesses","85","index","","","training","","","AI Marketing Trends 2025 Bulgarian Businesses: €2.3M ROI Guide","AI marketing trends 2025 Bulgarian businesses transformation guide. Achieve €2.3M savings, 60% cost reduction &amp; 4x ROI with automation.
","","","","",""
"1737","post","ki-projektmanagement-funktionen","KI-Projektmanagement Funktionen – Sicher &amp; DSGVO-konform","KI-Projektmanagement Funktionen im Überblick: DSGVO-konform, sicher &amp; ideal für KMU. Mit Monitoring, Automatisierung, digitalen Zwillingen &amp; Datensicherheit.","no","KI-Projektmanagement Funktionen,Sicheres KI-Projektmanagement,DSGVO-konforme KI-Tools,Projektmanagement SaaS für KMU","70","index","","","","","","","","","","","",""
"1805","post","home","Sicheres KI-Projektmanagement für deutsche KMU | Varna Agenten - DSGVO-konforme AI Automation","Entdecken Sie sicheres KI-Projektmanagement mit Varna Agenten. DSGVO-konform, transparent und speziell für KMU in Deutschland entwickelt.","no","sicheres KI-Projektmanagement,GDPR AI tools,project management SaaS,AI workflow automation","82","index","","","","","","","","","","","",""
"3896","post","ai-threat-detection","AI threat detection for SMEs: automated cybersecurity made simple","AI threat detection that prevents attacks in real time. Automate incident response and stay compliant with Classic Security.
","no","AI threat detection,cybersecurity automation,SOC automation,machine learning security,AI incident response,threat intelligence platform,anomaly detection,automated remediation,how does AI threat detection work?,what are the benefits of AI in cybersecurity?,is AI threat detection reliable for SMEs?","82","index","","","development","{""BlogPosting"":{""metadata"":{""type"":""custom"",""title"":""Article""},""@type"":""BlogPosting"",""headline"":""AI Threat Detection for SMEs: Automated Cybersecurity Made Simple"",""description"":""AI threat detection that prevents attacks in real time. Automate incident response and stay compliant with Classic Security."",""image"":""https://classicsecurity.net/assets/ai-threat-detection-dashboard-1200x675.jpg"",""author"":{""@type"":""Organization"",""name"":""Classic Security""},""publisher"":{""@type"":""Organization"",""name"":""Classic Security"",""logo"":{""@type"":""ImageObject"",""url"":""https://classicsecurity.net/assets/logo.png""}},""mainEntityOfPage"":""https://classicsecurity.net/blog/ai-threat-detection"",""datePublished"":""2025-10-05"",""dateModified"":""2025-10-05""},""FAQPage"":{""metadata"":{""type"":""custom"",""title"":""FAQPage""},""@type"":""FAQPage"",""mainEntity"":[{""@type"":""Question"",""name"":""How does AI threat detection work?"",""acceptedAnswer"":{""@type"":""Answer"",""text"":""It analyzes logs, behavior, and network traffic to identify anomalies using ML models.""}},{""@type"":""Question"",""name"":""What are the benefits of AI in cybersecurity?"",""acceptedAnswer"":{""@type"":""Answer"",""text"":""Automation, accuracy, and 24/7 coverage. Reduces human fatigue and error.""}},{""@type"":""Question"",""name"":""Is AI threat detection reliable for SMEs?"",""acceptedAnswer"":{""@type"":""Answer"",""text"":""Yes. Cloud-native AI models scale to SME data volumes with affordable pricing.""}},{""@type"":""Question"",""name"":""Does it replace analysts?"",""acceptedAnswer"":{""@type"":""Answer"",""text"":""No. It augments them, handling repetitive tasks and surfacing critical incidents.""}},{""@type"":""Question"",""name"":""Is it GDPR and ISO compliant?"",""acceptedAnswer"":{""@type"":""Answer"",""text"":""Yes. Classic Security embeds compliance logging, encryption, and retention policies.""}},{""@type"":""Question"",""name"":""Can AI prevent phishing or ransomware?"",""acceptedAnswer"":{""@type"":""Answer"",""text"":""AI models detect behavioral patterns typical of phishing and isolate affected systems.""}}]}}","","","","","","","",""
"4654","post","secure-ai-for-smes-eu-ai-act-nis2","Secure AI for SMEs | EU AI Act & NIS2 Compliance Playbook 2025","Discover how Secure AI for SMEs ensures GDPR, EU AI Act & NIS2 compliance in 2025. Practical defense strategies to safeguard your AI systems.","no","Secure AI for SMEs","87","","","","development","","","Secure AI for SMEs | EU AI Act &amp; NIS2 Compliance Playbook 2025","Discover how Secure AI for SMEs ensures GDPR, EU AI Act &amp; NIS2 compliance in 2025. Practical defense strategies to safeguard your AI systems.","","","","",""
"4806","post","agentic-ai-applications","Agentic AI Applications: 7 Breakthrough Use Cases + Strategy | Varna AI ","Agentic AI Applications are transforming industries — discover 7 real use cases, strategy tips, and how Varna AI leads the way.  
","no","agentic AI applications","87","index","","","development","{""Article"":{""metadata"":{""type"":""custom"",""title"":""Article""},""@type"":""Article"",""headline"":""Agentic AI Applications: A New Frontier for Businesses"",""alternativeHeadline"":""Agentic AI Applications - 7 Breakthrough Use Cases | Varna AI"",""description"":""Agentic AI Applications are transforming industries. Discover 7 real use cases, strategy tips, and how Varna AI leads the way."",""image"":[""https://varnaai.com/images/agentic-ai-applications-hero.webp"",""https://varnaai.com/images/agentic-ai-applications-statistics.webp"",""https://varnaai.com/images/agentic-ai-applications-trends.webp""],""author"":{""@type"":""Organization"",""name"":""Varna AI"",""url"":""https://varnaai.com""},""publisher"":{""@type"":""Organization"",""name"":""Varna AI"",""logo"":{""@type"":""ImageObject"",""url"":""https://varnaai.com/logo.png""}},""datePublished"":""2025-10-04"",""dateModified"":""2025-10-04"",""mainEntityOfPage"":""https://varnaai.com/agentic-ai-applications"",""keywords"":""Agentic AI Applications, AI agents, autonomous AI, AI governance, EU AI Act"",""wordCount"":""2200"",""timeRequired"":""PT9M"",""about"":{""@type"":""Thing"",""name"":""Agentic AI Applications""}},""FAQPage"":{""metadata"":{""type"":""custom"",""title"":""FAQPage""},""@type"":""FAQPage"",""mainEntity"":[{""@type"":""Question"",""name"":""What distinguishes Agentic AI Applications from chatbots or generative tools?"",""acceptedAnswer"":{""@type"":""Answer"",""text"":""Agentic AI Applications initiate, plan, and act autonomously, maintaining context over time, unlike chatbots which only respond to prompts.""}},{""@type"":""Question"",""name"":""Are Agentic AI Applications safe?"",""acceptedAnswer"":{""@type"":""Answer"",""text"":""Yes\\u2014when built with safety constraints, human oversight, and compliance with the EU AI Act, Agentic AI Applications can operate securely.""}},{""@type"":""Question"",""name"":""Which industries benefit most from Agentic AI Applications?"",""acceptedAnswer"":{""@type"":""Answer"",""text"":""Supply chain, maritime logistics, healthcare, smart infrastructure, and R&amp;D are early adopters gaining measurable ROI.""}},{""@type"":""Question"",""name"":""How costly is it to build an Agentic AI Application?"",""acceptedAnswer"":{""@type"":""Answer"",""text"":""Pilot Agentic AI Applications are affordable for SMEs; scaling multi-agent systems with governance layers requires higher investment.""}},{""@type"":""Question"",""name"":""How can SMEs start using Agentic AI Applications?"",""acceptedAnswer"":{""@type"":""Answer"",""text"":""Begin with a small, well-defined use case, integrate human oversight, evaluate results, then scale gradually.""}}]}}","","","","","","","",""
"316289","post","top-seo-trends-2025-what-marketers-need-to-know","Top SEO Trends 2025: What Marketers Need To Know Now","Discover the top SEO trends 2025 and learn what strategies marketers need to succeed in search rankings and digital growth. Call us today!","no","SEO Trends 2025","86","index","","","development","","","","","","","","",""
"316321","post","portfolio-ai-projektmanagement","Portfolio – Sichere AI Projektmanagement-Lösungen","Entdecken Sie unser Portfolio sicherer AI Projektmanagement-Lösungen. GDPR-konform, für deutsche KMU. Jetzt erfolgreiche Beispiele ansehen!","no","AI Projektmanagement,sichere AI Projektmanagement-Lösungen,GDPR-konforme KI-Tools,KMU Automatisierung","78","index","","","","","","","","","","","",""
"316323","post","varna-agenten-team","Varna Agenten Team | KI-Experten für sichere Automatisierung","Lernen Sie das Varna Agenten Team kennen: Experten für KI-Agenten, Projektmanagement und EU-konforme Automatisierung. Transparent &amp; DSGVO-sicher.","no","varna agenten team,ki experten deutschland,projektmanagement ai team,ai agenten entwickler","72","index","","","","","","","","","","","",""
"316325","post","services","Sichere KI-Projektmanagement-Services für KMU","Entdecken Sie sichere, GDPR-konforme KI-Projektmanagement-Services für KMU in Deutschland. Automatisieren Sie Workflows – starten Sie jetzt mit Varna AI.","no","secure AI project manager,GDPR AI tools,AI project management SaaS,SME automation","25","index","","","","","","","","","","","",""
"316423","post","kontakt-varna-agenten__trashed","Kontakt KI Agenten – Beste Varna Agenten 2025 für smarte Automatisierung","Kontakt KI Agenten – Die besten Varna Agenten 2025 helfen dir mit smarten KI-Lösungen, um Prozesse zu automatisieren und dein Business effizienter zu machen. Jetzt kontaktieren!","no","Kontakt Varna Agenten,Kontakt aufnehmen Varna Agenten,AI Projektmanagement Kontakt,DSGVO-konformer Kontakt Varna Agenten","25","","","","","","","Kontakt KI Agenten – Beste Varna Agenten 2025 für smarte Automatisierung","Kontakt KI Agenten – Die besten Varna Agenten 2025 helfen dir mit smarten KI-Lösungen, um Prozesse zu automatisieren und dein Business effizienter zu machen. Jetzt kontaktieren!","","","","",""
"316464","post","ki-agenten-im-vertrieb","KI-Agenten im Vertrieb: 7 Ways to Boost Sales Success","KI-Agenten im Vertrieb steigern Effizienz und Umsatz. Automatisiere Lead-Qualifizierung und Kundenkommunikation mit Varna Agenten.","no","KI-Agenten im Vertrieb,Vertriebsautomatisierung,KI-Vertriebsassistent,Lead-Qualifizierung,digitale Agenten,KI im Vertrieb,Automatisierung im Verkauf,Kundenmanagement,wie funktionieren KI-Agenten im Vertrieb?,welche Vorteile bringt Vertriebsautomatisierung?,ist KI im Vertrieb DSGVO-konform?","84","index","","","maschinelles-lernen","{""BlogPosting"":{""metadata"":{""type"":""custom"",""title"":""Article""},""@type"":""BlogPosting"",""headline"":""KI-Agenten im Vertrieb: Wie intelligente Systeme den Verkauf automatisieren"",""description"":""KI-Agenten im Vertrieb steigern Effizienz und Umsatz. Automatisiere Lead-Qualifizierung und Kundenkommunikation mit Varna Agenten."",""image"":""https://varna-agenten.de/assets/ki-agenten-vertrieb-dashboard-1200x675.jpg"",""author"":{""@type"":""Organization"",""name"":""Varna Agenten""},""publisher"":{""@type"":""Organization"",""name"":""Varna Agenten"",""logo"":{""@type"":""ImageObject"",""url"":""https://varna-agenten.de/assets/logo.png""}},""mainEntityOfPage"":""https://varna-agenten.de/blog/ki-agenten-im-vertrieb"",""datePublished"":""2025-10-05"",""dateModified"":""2025-10-05""},""FAQPage"":{""metadata"":{""type"":""custom"",""title"":""FAQPage""},""@type"":""FAQPage"",""mainEntity"":[{""@type"":""Question"",""name"":""Wie funktionieren KI-Agenten im Vertrieb?"",""acceptedAnswer"":{""@type"":""Answer"",""text"":""Sie analysieren Kundendaten, bewerten Leads automatisch und f\\u00fchren erste Gespr\\u00e4che \\u00fcber E-Mail oder Chat.""}},{""@type"":""Question"",""name"":""Welche Vorteile bringt Vertriebsautomatisierung?"",""acceptedAnswer"":{""@type"":""Answer"",""text"":""Weniger Routineaufgaben, mehr Zeit f\\u00fcr Abschl\\u00fcsse, h\\u00f6here Conversion-Raten.""}},{""@type"":""Question"",""name"":""Ist KI im Vertrieb DSGVO-konform?"",""acceptedAnswer"":{""@type"":""Answer"",""text"":""Ja, wenn Einwilligungen dokumentiert und Daten pseudonymisiert werden.""}},{""@type"":""Question"",""name"":""Wie lange dauert die Einf\\u00fchrung?"",""acceptedAnswer"":{""@type"":""Answer"",""text"":""In der Regel 2\\u20134 Wochen, abh\\u00e4ngig von Systemlandschaft und Datenvolumen.""}},{""@type"":""Question"",""name"":""Brauchen Agenturen eigenes IT-Personal?"",""acceptedAnswer"":{""@type"":""Answer"",""text"":""Nein, Varna Agenten bietet Managed Services inklusive Wartung.""}},{""@type"":""Question"",""name"":""Wie kann ich starten?"",""acceptedAnswer"":{""@type"":""Answer"",""text"":""\\u00dcber /demo oder direkt mit einem Testzugang unter /signup.""}}]}}","","","","","","","",""
"316591","post","agentic-ai-automation-future-autonomous-systems__trashed","Agentic AI Automation: Transforming Autonomous Systems","Agentic AI automation drives business efficiency with autonomous AI systems that execute workflows and decisions intelligently.","no","agentic AI automation,autonomous AI systems,AI workflow automation,business automation tools,AI agents 2025,enterprise AI solutions,AI orchestration,AI productivity,what is agentic AI automation?,how do autonomous AI systems improve business efficiency?,what are the top AI agents in 2025?","81","","","https://varnaai.com/blog/agentic-ai-automation-future-autonomous-systems",,"{""BlogPosting"":{""metadata"":{""type"":""custom"",""title"":""Article""},""@type"":""BlogPosting"",""headline"":""Agentic AI Automation: The Future of Autonomous Systems"",""description"":""Agentic AI automation drives business efficiency with autonomous AI systems that execute workflows and decisions intelligently."",""author"":{""@type"":""Organization"",""name"":""Varna AI""},""publisher"":{""@type"":""Organization"",""name"":""Varna AI"",""url"":""https://varnaai.com""},""url"":""https://varnaai.com/blog/agentic-ai-automation-future-autonomous-systems"",""image"":""https://varnaai.com/images/agentic-ai-automation.jpg"",""mainEntityOfPage"":""https://varnaai.com/blog/agentic-ai-automation-future-autonomous-systems"",""datePublished"":""2025-10-11"",""inLanguage"":""en"",""isPartOf"":{""@type"":""WebSite"",""name"":""Varna AI Blog"",""url"":""https://varnaai.com/blog""}},""FAQPage"":{""metadata"":{""type"":""custom"",""title"":""FAQPage""},""@type"":""FAQPage"",""mainEntity"":[{""@type"":""Question"",""name"":""What is agentic AI automation?"",""acceptedAnswer"":{""@type"":""Answer"",""text"":""Agentic AI automation uses autonomous agents capable of planning and executing tasks with minimal human input.""}},{""@type"":""Question"",""name"":""How does it differ from traditional AI?"",""acceptedAnswer"":{""@type"":""Answer"",""text"":""Traditional AI reacts, while agentic AI acts proactively and collaborates with other agents.""}},{""@type"":""Question"",""name"":""Can Varna AI integrate with existing tools?"",""acceptedAnswer"":{""@type"":""Answer"",""text"":""Yes. Varna AI integrates via secure API and workflow connectors.""}},{""@type"":""Question"",""name"":""Is agentic AI GDPR-compliant?"",""acceptedAnswer"":{""@type"":""Answer"",""text"":""Yes, Varna AI logs all agent decisions and data flows for full auditability.""}},{""@type"":""Question"",""name"":""What industries benefit most?"",""acceptedAnswer"":{""@type"":""Answer"",""text"":""Finance, logistics, e-commerce, and manufacturing gain the most ROI.""}},{""@type"":""Question"",""name"":""How can I test the platform?"",""acceptedAnswer"":{""@type"":""Answer"",""text"":""Request a free demo at https://varnaai.com/demo to build a pilot agent.""}}]}}","","","","","","","",""
"316617","post","ai-agents-for-business-automation","5 Astounding Ways AI Agents for Business Automation Enhance Efficiency","Automate your workflows securely with AI agents for business automation. EU-hosted and GDPR-compliant, ready to scale your team. Book a demo today. AI Agents for Business Automation.","no","AI Agents for Business Automation, Autonomous AI Workflows, AI Process Automation, GDPR-Compliant AI Tools","86","","","","industry-insights","{""Service"":{""metadata"":{""type"":""custom"",""title"":""Service""},""@type"":""Service"",""name"":""AI Agents for Business Automation"",""provider"":{""@type"":""Organization"",""name"":""Varna AI"",""url"":""https://varnaai.com""},""areaServed"":""EU"",""serviceType"":""AI Automation"",""offers"":{""@type"":""Offer"",""url"":""https://varnaai.com/demo"",""priceCurrency"":""EUR"",""availability"":""https://schema.org/InStock""},""mainEntityOfPage"":""https://varnaai.com/ai-agents-for-business-automation""}}","","5 Astounding Ways AI Agents for Business Automation Enhance Efficiency","Automate your workflows securely with AI agents for business automation. EU-hosted and GDPR-compliant, ready to scale your team. Book a demo today. AI Agents for Business Automation.","","","","",""
"316622","post","autonomous-security-systems-ai-cybersecurity-2025","Autonomous Security Systems – AI Cybersecurity Automation 2025","Autonomous Security Systems use AI to detect, prevent, and respond to threats automatically. Learn how cybersecurity automation reshapes digital defense in 2025.","no","Autonomous Security Systems,AI cybersecurity,automated threat detection,machine learning security,zero trust automation,cyber defense AI,AI incident response,autonomous network protection","83","","","https://www.varnaai.com/autonomous-security-systems-ai-cybersecurity-2025",,"{""BlogPosting"":{""metadata"":{""type"":""custom"",""title"":""Article""},""@type"":""BlogPosting"",""headline"":""Autonomous Security Systems \\u2013 AI Cybersecurity Automation 2025"",""description"":""Autonomous Security Systems use AI to detect, prevent, and respond to threats automatically. Learn how cybersecurity automation reshapes digital defense in 2025."",""image"":""https://www.varnaai.com/images/featured-image.webp"",""author"":{""@type"":""Organization"",""name"":""Varna AI""},""publisher"":{""@type"":""Organization"",""name"":""Varna AI"",""logo"":{""@type"":""ImageObject"",""url"":""https://www.varnaai.com/logo.webp""}},""mainEntityOfPage"":{""@type"":""WebPage"",""@id"":""https://www.varnaai.com/autonomous-security-systems-ai-cybersecurity-2025""},""datePublished"":""2025-10-17"",""dateModified"":""2025-10-17"",""keywords"":""Autonomous Security Systems, AI cybersecurity, automated threat detection, machine learning security, zero trust automation, cyber defense AI, AI incident response, autonomous network protection"",""articleSection"":""Security &amp; Compliance"",""inLanguage"":""en"",""wordCount"":""2060""},""FAQPage"":{""metadata"":{""type"":""custom"",""title"":""FAQPage""},""@type"":""FAQPage"",""mainEntity"":[{""@type"":""Question"",""name"":""How do autonomous security systems prevent cyberattacks?"",""acceptedAnswer"":{""@type"":""Answer"",""text"":""They use real-time data correlation and behavioral models to identify and neutralize threats before impact.""}},{""@type"":""Question"",""name"":""What are the benefits of AI in cybersecurity automation?"",""acceptedAnswer"":{""@type"":""Answer"",""text"":""Improved accuracy, faster response times, reduced operational cost, and fewer false alerts.""}},{""@type"":""Question"",""name"":""Can machine learning replace traditional monitoring?"",""acceptedAnswer"":{""@type"":""Answer"",""text"":""Machine learning automates detection, but humans validate complex or contextual incidents.""}},{""@type"":""Question"",""name"":""Is autonomous security GDPR compliant?"",""acceptedAnswer"":{""@type"":""Answer"",""text"":""Yes, systems must include audit logs and transparency layers.""}},{""@type"":""Question"",""name"":""How fast do these systems respond to attacks?"",""acceptedAnswer"":{""@type"":""Answer"",""text"":""Milliseconds, depending on model inference speed and network latency.""}},{""@type"":""Question"",""name"":""Can SMEs afford autonomous systems?"",""acceptedAnswer"":{""@type"":""Answer"",""text"":""Yes, cloud-based security automation is cost-scalable and accessible to smaller enterprises.""}}]}}","","Title: Revolutionizing Cyber Defense: Autonomous Security Systems and AI Cybersecurity Automation for 2025","Discover how Autonomous Security Systems leverage AI for automated threat detection and incident response. Explore the future of machine learning security, zero trust automation, and autonomous network protection to enhance your cyber defense strategy in 2025. Stay ahead of emerging threats and safeguard your business with cutting-edge AI cybersecurity solutions.","","","","",""
"316645","post","multi-agent-ai-systems-enterprise-automation","7 Ways Multi-Agent AI Systems Are Unlocking New Opportunities","Multi-Agent AI Systems enhance enterprise automation through autonomous collaboration, intelligent orchestration, and distributed intelligence.","no","Multi-Agent AI Systems,AI collaboration,autonomous agents,intelligent automation,enterprise AI,agent-based systems,What are multi-agent AI systems?,How do autonomous agents work in business?","83","","","https://varnaai.com/blog/multi-agent-ai-systems-enterprise-automation",,"{""BlogPosting"":{""metadata"":{""type"":""custom"",""title"":""Article""},""@type"":""BlogPosting"",""headline"":""Multi-Agent AI Systems: The Future of Enterprise Automation"",""description"":""Multi-Agent AI Systems enhance enterprise automation through autonomous collaboration, intelligent orchestration, and distributed intelligence."",""image"":""https://varnaai.com/blog/images/featured-image.webp"",""author"":{""@type"":""Organization"",""name"":""Varna AI""},""publisher"":{""@type"":""Organization"",""name"":""Varna AI"",""logo"":{""@type"":""ImageObject"",""url"":""https://varnaai.com/logo.png""}},""url"":""https://varnaai.com/blog/multi-agent-ai-systems-enterprise-automation"",""mainEntityOfPage"":{""@type"":""WebPage"",""@id"":""https://varnaai.com/blog/multi-agent-ai-systems-enterprise-automation""},""datePublished"":""2025-10-23"",""dateModified"":""2025-10-23"",""articleSection"":""AI Technology"",""keywords"":[""Multi-Agent AI Systems"",""autonomous agents"",""AI orchestration"",""distributed intelligence"",""enterprise automation""]},""FAQPage"":{""metadata"":{""type"":""custom"",""title"":""FAQPage""},""@type"":""FAQPage"",""mainEntity"":[{""@type"":""Question"",""name"":""What are Multi-Agent AI Systems?"",""acceptedAnswer"":{""@type"":""Answer"",""text"":""They are networks of autonomous agents collaborating to solve complex enterprise automation tasks using shared intelligence.""}},{""@type"":""Question"",""name"":""How do autonomous agents work in business?"",""acceptedAnswer"":{""@type"":""Answer"",""text"":""They analyze data, make independent decisions, and communicate with other agents to optimize workflows.""}},{""@type"":""Question"",""name"":""What industries benefit most?"",""acceptedAnswer"":{""@type"":""Answer"",""text"":""Manufacturing, finance, and IT services adopt multi-agent systems for process efficiency and risk reduction.""}},{""@type"":""Question"",""name"":""How is data security maintained?"",""acceptedAnswer"":{""@type"":""Answer"",""text"":""Security is achieved through zero-trust encryption, access control, and ISO 27001-compliant auditing.""}},{""@type"":""Question"",""name"":""What role does AI orchestration play?"",""acceptedAnswer"":{""@type"":""Answer"",""text"":""AI orchestration coordinates multiple agents to ensure optimal resource use and conflict-free collaboration.""}},{""@type"":""Question"",""name"":""Can SMEs afford multi-agent deployment?"",""acceptedAnswer"":{""@type"":""Answer"",""text"":""Yes. Modular Varna AI tiers enable affordable deployment for small and medium enterprises.""}}]}}","","","","","","","",""
